{
  "run": {
    "cog": "recurring-subscription-auto-coder-cog",
    "version": "0.0.1",
    "transaction_shape": "0.2.0",
    "at": "2026-10-14T12:00:00+00:00",
    "mode": "strict",
    "binding": null,
    "inputs": {
      "month": {
        "file": "brex-transactions-2026-09.csv",
        "sha256": "0000000000000000000000000000000000000000000000000000000000000000"
      },
      "history": [
        {
          "file": "brex-transactions-2026-07.csv",
          "sha256": "0000000000000000000000000000000000000000000000000000000000000000"
        },
        {
          "file": "brex-transactions-2026-08.csv",
          "sha256": "0000000000000000000000000000000000000000000000000000000000000000"
        }
      ]
    },
    "columns": [
      {
        "file": "brex-transactions-2026-09.csv",
        "read": 22,
        "ignored": 48,
        "optional_missing": []
      },
      {
        "file": "brex-transactions-2026-07.csv",
        "read": 22,
        "ignored": 48,
        "optional_missing": []
      },
      {
        "file": "brex-transactions-2026-08.csv",
        "read": 22,
        "ignored": 48,
        "optional_missing": []
      }
    ],
    "context": {
      "vendors": {
        "version": "0.0.1",
        "status": "synthetic",
        "from": "override"
      },
      "known-recurring": {
        "version": "0.0.1",
        "status": "synthetic",
        "from": "override"
      },
      "coding-rules": {
        "version": "0.0.1",
        "status": "synthetic",
        "from": "override"
      },
      "chart-of-accounts": {
        "version": "0.0.1",
        "status": "synthetic",
        "from": "override"
      },
      "quickbooks": {
        "version": "1",
        "status": "settings",
        "from": "default"
      }
    },
    "tolerance": 0.1,
    "counts": {
      "transactions": 51,
      "history_transactions": 67,
      "history_months": [
        "2026-07",
        "2026-08"
      ],
      "unparsed_rows": 0,
      "unmatched_descriptors": 0,
      "vendor_sources": {
        "context": 46,
        "export": 5
      },
      "amount_flags": 0,
      "labels": {
        "amount-changed": 1,
        "likely-recurring": 1,
        "new": 1,
        "one-off": 18,
        "recurring": 30
      },
      "coding": {
        "not-included": 18,
        "ready": 32,
        "waiting-for-post": 1
      },
      "blank_fields": {
        "CLASS": 3,
        "DEPARTMENT": 3,
        "MEMO": 31
      }
    },
    "abstention_rate": 0.094,
    "warnings": [
      "synthetic (invented) context files in use: vendors, known-recurring, coding-rules, chart-of-accounts"
    ]
  },
  "transactions": [
    {
      "id": "tx_0905a",
      "source": {
        "file": "brex-transactions-2026-09.csv",
        "row": 13
      },
      "parsed": {
        "transaction_id": "tx_0905a",
        "status": "posted",
        "transaction_date": "2026-09-05",
        "posted_date": "2026-09-08",
        "card_last4": "4417",
        "cardholder": "Jordan Lee",
        "merchant_name": "Datadog",
        "merchant_descriptor": "DATADOG INC",
        "amount": 611.42,
        "currency": "USD",
        "original_amount": 611.42,
        "original_currency": "USD",
        "type": "Card",
        "reference_id": "ref_tx_0905a",
        "brex_category": "Recurring software & SaaS",
        "memo": null,
        "receipt_attached": false,
        "spender_department": "Engineering",
        "brex_account": "Expenses:6110 Software Subscriptions",
        "brex_class": null,
        "brex_department": null,
        "brex_vendor": null
      },
      "inferred": {
        "vendor": {
          "id": "datadog",
          "category": "subscription",
          "billing": "usage",
          "source": "context",
          "pattern": "^DATADOG"
        },
        "recurrence": {
          "label": "recurring",
          "reason": "usage-billed; charged in 2 earlier months",
          "source": "history",
          "billing": "usage",
          "amount_flag": null,
          "why_subscription": [
            "on the vendor list as a subscription, usage billing",
            "Brex category: Recurring software & SaaS",
            "charged in 2 earlier months (2026-07, 2026-08)"
          ],
          "evidence": {
            "known_recurring": false,
            "months_seen": [
              "2026-07",
              "2026-08"
            ],
            "months_matching_amount": [
              "2026-07",
              "2026-08"
            ],
            "earlier_amounts": [
              575.0,
              590.1
            ],
            "vs_last_charge": {
              "last_amount": 590.1,
              "month": "2026-08",
              "change_percent": 3.6
            }
          }
        },
        "coding": {
          "status": "ready",
          "source": "rule",
          "entry": {
            "DATE": "09/05/2026",
            "REF NO.": "4417",
            "TYPE": "Credit Card Expense",
            "PAYEE": "Datadog",
            "ACCOUNT": "6120",
            "MEMO": "",
            "CLASS": "Engineering",
            "DEPARTMENT": "Engineering",
            "CHARGE": "611.42"
          },
          "from": {
            "DATE": "export",
            "REF NO.": "export",
            "TYPE": "context",
            "PAYEE": "export",
            "ACCOUNT": "rule",
            "MEMO": "none",
            "CLASS": "rule",
            "DEPARTMENT": "rule",
            "CHARGE": "export"
          },
          "blank": [
            "MEMO"
          ],
          "review": null
        }
      }
    },
    {
      "id": "tx_0910c",
      "source": {
        "file": "brex-transactions-2026-09.csv",
        "row": 33
      },
      "parsed": {
        "transaction_id": "tx_0910c",
        "status": "posted",
        "transaction_date": "2026-09-10",
        "posted_date": "2026-09-11",
        "card_last4": "1290",
        "cardholder": "Alex Rivera",
        "merchant_name": "Delta Air Lines",
        "merchant_descriptor": "DELTA AIR 0062384719263",
        "amount": 684.4,
        "currency": "USD",
        "original_amount": 684.4,
        "original_currency": "USD",
        "type": "Card",
        "reference_id": "ref_tx_0910c",
        "brex_category": "Airfare",
        "memo": null,
        "receipt_attached": false,
        "spender_department": "Executive",
        "brex_account": "Expenses:6400 Travel",
        "brex_class": null,
        "brex_department": null,
        "brex_vendor": null
      },
      "inferred": {
        "vendor": {
          "id": "delta",
          "category": "travel",
          "billing": null,
          "source": "context",
          "pattern": "^DELTA AIR"
        },
        "recurrence": {
          "label": "one-off",
          "reason": "travel vendor",
          "source": "history",
          "billing": "usage",
          "amount_flag": null,
          "why_subscription": [],
          "evidence": {
            "known_recurring": false,
            "months_seen": [],
            "months_matching_amount": [],
            "earlier_amounts": [],
            "vs_last_charge": null
          }
        },
        "coding": {
          "status": "not-included",
          "source": "none",
          "reason": "not a subscription: travel vendor"
        }
      }
    },
    {
      "id": "tx_0924a",
      "source": {
        "file": "brex-transactions-2026-09.csv",
        "row": 45
      },
      "parsed": {
        "transaction_id": "tx_0924a",
        "status": "posted",
        "transaction_date": "2026-09-24",
        "posted_date": "2026-09-25",
        "card_last4": "1290",
        "cardholder": "Alex Rivera",
        "merchant_name": "Slack",
        "merchant_descriptor": "SLACK T03AB9XYZ",
        "amount": 142.5,
        "currency": "USD",
        "original_amount": 142.5,
        "original_currency": "USD",
        "type": "Card",
        "reference_id": "ref_tx_0924a",
        "brex_category": "Recurring software & SaaS",
        "memo": null,
        "receipt_attached": false,
        "spender_department": "Executive",
        "brex_account": "Expenses:6110 Software Subscriptions",
        "brex_class": null,
        "brex_department": null,
        "brex_vendor": null
      },
      "inferred": {
        "vendor": {
          "id": "slack",
          "category": "subscription",
          "billing": "fixed",
          "source": "context",
          "pattern": "^SLACK "
        },
        "recurrence": {
          "label": "amount-changed",
          "reason": "fixed price; amount down 86.7% on last charge (1068.75)",
          "source": "history",
          "billing": "fixed",
          "amount_flag": null,
          "why_subscription": [
            "on the vendor list as a subscription, fixed billing",
            "Brex category: Recurring software & SaaS",
            "on the known-recurring list",
            "charged in 2 earlier months (2026-07, 2026-08)"
          ],
          "evidence": {
            "known_recurring": true,
            "months_seen": [
              "2026-07",
              "2026-08"
            ],
            "months_matching_amount": [],
            "earlier_amounts": [
              1068.75
            ],
            "vs_last_charge": {
              "last_amount": 1068.75,
              "month": "2026-08",
              "change_percent": -86.7
            }
          }
        },
        "coding": {
          "status": "ready",
          "source": "rule",
          "entry": {
            "DATE": "09/24/2026",
            "REF NO.": "1290",
            "TYPE": "Credit Card Expense",
            "PAYEE": "Slack",
            "ACCOUNT": "6110",
            "MEMO": "",
            "CLASS": "G&A",
            "DEPARTMENT": "Operations",
            "CHARGE": "142.50"
          },
          "from": {
            "DATE": "export",
            "REF NO.": "export",
            "TYPE": "context",
            "PAYEE": "export",